{
  "$schema": "http://json-schema.org/draft-07/schema#",
  "$id": "https://wzrd.tech/schemas/agent-plugins-1.0.0/plugin.json",
  "title": "Agent Plugins 1.0.0 — plugin.json",
  "type": "object",
  "additionalProperties": false,
  "required": ["name", "version", "description", "author"],
  "properties": {
    "name": { "type": "string", "pattern": "^[a-z0-9][a-z0-9-]*$", "maxLength": 64 },
    "version": { "type": "string", "pattern": "^[0-9]+\\.[0-9]+\\.[0-9]+(-[0-9A-Za-z.-]+)?$" },
    "description": { "type": "string", "minLength": 10, "maxLength": 400 },
    "author": {
      "oneOf": [
        { "type": "string", "minLength": 1 },
        {
          "type": "object",
          "additionalProperties": false,
          "required": ["name"],
          "properties": {
            "name": { "type": "string", "minLength": 1 },
            "email": { "type": "string" },
            "url": { "type": "string" }
          }
        }
      ]
    },
    "homepage": { "type": "string" },
    "license": { "type": "string" },
    "keywords": { "type": "array", "items": { "type": "string" } }
  }
}
