{
  "name": "wzrd-studio",
  "version": "0.2.0",
  "description": "Drive WZRD Studio from your agent: set up projects, storyboard, generate shots, run studio graphs, edit timelines and export video.",
  "author": "5-DEE",
  "homepage": "https://wzrd.tech",
  "license": "UNLICENSED",
  "keywords": ["video", "storyboard", "generation", "mcp", "wzrd"]
}
